Framework,Id,Score,ViewCount,Title,Tags,AnswerCount,Category
Spring,36581834,1,602,where is port 8080 defined in spring cloud app?,<spring><spring-boot><spring-cloud><netflix-zuul>,3,REFERENCE
Spring,36655518,1,861,disable confirmation page in Spring OAuth2,<spring><spring-mvc><spring-security><spring-boot><spring-oauth2>,1,RUNNING
Spring,36683434,4,10867,How to autowire this TokenStore,<spring><spring-security><spring-boot><autowired><spring-oauth2>,2,MODIFY
Spring,36899386,9,1266,null client in OAuth2 Multi-Factor Authentication,<spring><spring-mvc><spring-security><spring-boot><spring-security-oauth2>,1,REFERENCE
Spring,37970709,16,15445,Could not autowire field: private org.springframework.security.authentication.AuthenticationManager,<java><spring><spring-mvc><spring-security><spring-boot>,3,MODIFY
Spring,38698426,4,911,Spring security with AngularJS - logout does not work,<java><angularjs><google-chrome><spring-security><logout>,1,MODIFY
Spring,34751700,9,7222,Spring Zuul API Gateway with Spring Session / Redis Authenticate and Route in same Request,<spring-security><spring-cloud><spring-session>,2,MODIFY
Spring,39233986,1,72,Not able to run the starter guide code of IMPORTing Spring Boot Rest Service,<spring><web-services><rest><maven><spring-boot>,1,RUNNING
Spring,40357318,1,539,Spring Boot and OAuth2 example: redirect not working,<spring><spring-security><oauth2>,1,MODIFY
Spring,40585031,7,11431,Unable to start springboot app - Resource location must not be null,<spring><spring-boot>,4,IMPORT
Spring,40802405,1,641,Spring session login,<java><spring><session>,1,REFERENCE
Spring,40775533,1,628,Spring SSO authorization fails without context-path,<java><spring><spring-security>,2,MODIFY
Spring,41092751,35,19035,Spring injects dependencies in constructor without @Autowired annotation,<spring><spring-boot><dependency-injection><autowired>,1,REFERENCE
Spring,41429778,4,4602,Spring Security logout and Maximum sessions,<java><spring><spring-mvc><session><spring-security>,1,MODIFY
Spring,41578040,2,778,Spring OAuth2: support auth and resource access with both SSO and custom auth server,<spring-boot><single-sign-on><spring-security-oauth2>,1,REFERENCE
Spring,42102689,1,2727,Consider defining a bean of type 'org.springframework.data.redis.connection.RedisConnectionFactory' in your configuration,<spring-security><spring-session><spring-data-redis>,1,IMPORT
Spring,42420125,2,596,Spring Boot Oauth2 with slack,<spring-boot><oauth-2.0><slack>,1,MODIFY
Spring,42721597,1,7037,Spring Boot - Request method 'POST' not supported (Method not allowed),<java><spring><spring-mvc><post>,3,MODIFY
Spring,43150564,2,168,"What does $(""something"") mean in Java?",<java>,2,REFERENCE
Spring,36730903,5,8564,Add custom UserDetailsService to Spring Security OAuth2 app,<spring><spring-security><spring-boot><spring-security-oauth2><spring-oauth2>,2,MODIFY
Spring,43374658,1,897,Spring Oauth2 SSO - Unable to logout from the Auth server,<angularjs><spring><spring-security><oauth-2.0><spring-security-oauth2>,2,REFERENCE
Spring,45136514,1,1970,OAuth2 SSO with Spring Boot without the authorization screen,<java><spring><spring-boot><jwt><spring-security-oauth2>,1,REFERENCE
Spring,27987068,11,6800,Spring Boot Hibernate Syntax Error in SQL Statement,<spring><hibernate><jpa><spring-boot><spring-data-jpa>,2,MODIFY
Spring,45993586,2,300,How does the eureka client find the eureka server in spring boot 1.5.2?,<spring><spring-boot><spring-cloud><spring-cloud-netflix>,1,REFERENCE
Spring,46162061,3,433,How to get a CrudRepository instance?,<java><spring><spring-boot><spring-data-jpa><h2>,2,MODIFY
Spring,46174992,8,628,Missing client_id when accessing token with linkedIn,<spring><spring-security><oauth><spring-oauth2>,2,MODIFY
Spring,46732371,1,198,Why are there different types of integration tests in Spring Boot,<spring><testing><spring-boot><resttemplate><spring-test>,1,REFERENCE
Spring,43458500,10,3373,How to migrate Spring Boot JMS from ActiveMQ to Oracle Advanced Queueing,<java><oracle><spring-boot><spring-jms><advanced-queuing>,2,MODIFY
Spring,48772458,4,593,"could not find MavenWrapperMain class, but is contained within .m2 in the directory",<java><maven>,4,IMPORT
Spring,49942640,29,2165,Official Spring security oauth2 example doesn't work because of cookies clashing(authorization code mechanism),<java><spring-security><oauth-2.0><spring-oauth2>,3,RUNNING
Spring,51738718,2,598,FlatFileItemReader tab delimiter not working,<java><spring><spring-batch>,2,MODIFY
Spring,51736997,2,431,"How to configure project to auto reload browser in angular, spring-boot, maven project",<java><angular><maven><spring-boot><visual-studio-code>,1,MODIFY
Spring,37042106,3,505,Springboot 1.3.3 gives 404 in Jboss EAP 6.4.0GA,<java><spring><maven><jboss><spring-boot>,1,RUNNING
Spring,54750194,1,21,Find by property not working as expected in Spring Data Neo4j,<spring-data-neo4j>,1,RUNNING
Spring,23511605,1,553,Glassfish and Spring Boot: .war re-RUNNINGment failed,<spring><glassfish><spring-boot>,1,RUNNING
Spring,27643278,2,1888,spring-boot spring-mvc apache-commons-fileupload: Required MultipartFile parameter 'file' is not present error,<spring-mvc><spring-boot><apache-commons-fileupload>,1,MODIFY
Spring,29282870,1,133,purpose of adding events layer in DDD,<spring><tdd><domain-driven-design><event-sourcing>,1,REFERENCE
Spring,34821978,8,16335,How does callback work in AngularJS call to REST service?,<javascript><angularjs>,2,REFERENCE
Spring,36100395,5,5450,Spring Security Oauth2 SSO with Zuul Proxy,<spring><spring-security><spring-cloud><spring-security-oauth2>,1,MODIFY
Spring,36705874,7,3608,Request 'OPTIONS /logout' doesn't match 'POST /logout,<spring><spring-security><spring-boot><spring-cloud><spring-oauth2>,1,MODIFY
Spring,37061697,14,2025,Invalid XSRF token at /oauth/token,<spring><spring-mvc><spring-security><spring-boot><spring-oauth2>,2,REFERENCE
Spring,37598036,1,842,Spring Security OAuth2 doesn't kill the session and display login again,<java><spring-security><spring-boot><single-sign-on><spring-security-oauth2>,1,RUNNING
Spring,37780976,5,2100,"gpg: skipped ""XXBDXX4E"": secret key not available. gpg: signing failed: secret key not available",<git><github>,2,REFERENCE
Spring,38800564,5,2554,Azure AD and Spring Security with Oauth 2,<java><security><spring-mvc><oauth><azure-active-directory>,1,REFERENCE
Spring,38910280,3,601,Spring Boot with Angularjs Logout Error,<angularjs><spring><spring-security><spring-boot><logout>,1,RUNNING
Spring,39082691,4,2273,"Spring boot Security, Oauth2 logout, invalidate session in order to go through the authentication and approval cycle in the authorization server",<java><angularjs><spring-security><spring-boot><spring-security-oauth2>,2,RUNNING
Spring,39645590,5,7114,cors not working for my spring boot application,<spring><spring-mvc><spring-boot><cors><spring-mvc-test>,3,REFERENCE
Spring,40355743,5,2709,"File upload in Spring Boot: Uploading, validation, and exception handling",<java><tomcat><file-upload><spring-boot><thymeleaf>,2,MODIFY
Spring,40623809,1,347,Spring Cloud OAuth2: Adding user authorities,<spring-security><oauth-2.0><spring-cloud><spring-security-oauth2><spring-oauth2>,1,MODIFY
Spring,41738864,2,1105,Multiple SSO providers in Spring Boot Auth server,<java><spring-boot><oauth-2.0><spring-security-oauth2>,1,MODIFY
Spring,41850162,4,903,Spring Security OAuth2 AngularJS | Logout Flow,<spring-security><spring-security-oauth2>,3,MODIFY
Spring,42867921,4,931,Spring cannot configure authorization server,<java><spring><spring-boot><spring-security><spring-security-oauth2>,4,REFERENCE
Spring,43082213,4,2543,Spring Boot Oauth2 token request - Bad client credentials from BasicAuthenticationFilter,<spring-boot><oauth-2.0><token><credentials>,1,MODIFY
Spring,43431802,1,125,Spring tutorial accessing-data-jpa does not work,<spring><spring-boot><spring-data><spring-data-jpa>,1,RUNNING
Spring,47202657,1,1816,Spring Security OAuth2- POST request to oauth/token redirects to login and role displays ROLE_ANONYMOUS,<spring><spring-security><oauth><oauth-2.0><spring-security-oauth2>,3,MODIFY
Spring,47239476,2,1637,CORS and Spring Websocket,<spring><spring-boot><websocket><cors><stomp>,1,MODIFY
Spring,49939639,1,302,Spring oauth2 sso example doesn't work,<java><spring><spring-boot><oauth-2.0><spring-security-oauth2>,1,RUNNING
Spring,50141309,1,272,Error 404 bundle.js not found - Spring Data Rest and React.js,<javascript><spring><reactjs><spring-boot>,1,RUNNING
Spring,51348352,1,1662,What's the difference between management.server.port and management.port properties?,<spring-boot-actuator>,1,REFERENCE
Spring,53816713,1,81,How RUNNING source code as an application in a linux virtual machine on Azure using Jenkins?,<git><azure><jenkins><virtual-machine><jenkins-plugins>,2,IMPORT
Spring,55564608,1,230,How does Java Spring query MongoDB?,<java><spring><mongodb>,1,REFERENCE