Framework,Id,Score,ViewCount,Title,Tags,AnswerCount,Category
Android,47323883,11,1537,Why Room entities don't work with immutable properties in Android,<android><sqlite><kotlin><immutability><android-room>,2,REFERENCE
Android,37747466,4,570,Writing data to BluetoothSocket on the UI thread,<android><android-bluetooth>,3,REFERENCE
Android,45203918,2,659,Is JNI_OnLoad normally used for Android NDK?,<android><android-ndk><java-native-interface>,1,REFERENCE
Android,47451783,1,293,Could not take photo with front camera 2,<android><android-camera><android-camera2><front-camera>,1,MODIFY
Android,47868684,2,903,"In clean MVP, who should handle combining interactors?",<android><mvp><use-case><clean-architecture>,2,REFERENCE
Android,47866673,1,1912,Android Architecture Components: How is LiveData in the IMPORT observed by a ViewModel,<android><mvvm><viewmodel><android-architecture-components><android-livedata>,1,REFERENCE
Android,47727211,20,9731,Using LiveData with Data Binding,<android><kotlin><android-databinding><android-architecture-components><android-mvvm>,3,REFERENCE
Android,48094952,5,2615,Where does android.hardware.camera2.full come from?,<android><android-camera><android-camera2>,3,REFERENCE
Android,48039177,2,599,Android app architecture with BLE,<android><architecture><bluetooth-lowenergy>,1,REFERENCE
Android,48127910,1,219,test rxjava callback function,<android><unit-testing><mockito><rx-java2>,2,REFERENCE
Android,48172376,1,48,Can we use PDFRenderer in a service?,<android><pdf>,1,MODIFY
Android,48172364,3,3458,How to query a complex nested objects in Room?,<android><android-room>,2,REFERENCE
Android,47051069,3,317,downloadable fonts - can't download some google fonts,<android><fonts><google-font-api><google-fonts>,1,MODIFY
Android,46984467,1,164,Deprecated Inventory object from google play billing library 1.0?,<android><android-billing><play-billing-library>,1,REFERENCE
Android,48406497,10,1935,Camera2 understanding the sensor and device orientations,<android><rotation><android-camera2>,1,MODIFY
Android,48645234,1,452,Provisioning Device Owner and CosuApp,<android><android-for-work><cosu>,1,MODIFY
Android,48781673,3,1174,Proper way of using Fragments and MVP pattern,<android><android-fragments><mvp><android-mvp>,2,REFERENCE
Android,48774255,2,353,How to extend the Google android architecture dagger sample?,<java><android><dagger-2><dagger-android>,1,MODIFY
Android,48914977,4,469,Android Architecture Components GithubBrowserSample unit test understanding,<android><unit-testing><kotlin><mockito><android-architecture-components>,2,REFERENCE
Android,49029004,1,158,Why [onDataPoint] of google fit not call?,<android><google-fit>,1,MODIFY
Android,49212540,1,222,Android NDK OpenGLES not rendering triangles,<c++><opengl-es><android-ndk>,1,MODIFY
Android,49213525,1,238,Android Dagger 2 keep fragment alive as long as activity,<android><dagger-2><dagger-android>,1,MODIFY
Android,49232559,4,1722,ConstrainLayout ConstraintSet - not working properly with Start/End constrains,<android><android-constraintlayout>,2,MODIFY
Android,49417910,1,41,Location Updates on Boot - turn on and off in activity,<android><location>,1,MODIFY
Android,49488903,32,7467,LocationRequest constructor is marked as internal,<java><android><location>,2,MODIFY
Android,49590960,3,2004,Insert (or delete) single List item from LiveData,<android><android-architecture-components><android-livedata>,1,REFERENCE
Android,49588393,1,93,Promoting 'beta' apk to 'production' programmatically,<android><google-play-developer-api>,1,REFERENCE
Android,49688616,3,870,How does designing custom android DPC app relate to Android management API?,<android><kiosk-mode><cosu><android-enterprise><android-management-api>,1,REFERENCE
Android,49762991,1,327,"Where should I put the image download logic on Android, according to the MVP pattern?",<android><mvp><android-mvp>,2,REFERENCE
Android,46689217,3,243,Dagger 2 bindings delegation with subcomponents,<android><mvvm><dependency-injection><dagger-2>,1,REFERENCE
Android,49833533,5,3301,How to correctly mock ViewModel on androidTest,<android><kotlin><mockito><android-espresso><android-architecture-components>,5,REFERENCE
Android,50053555,1,260,Android TabLayout Fragment with MVP,<android-fragments><mvp><android-tablelayout>,1,MODIFY
Android,50362528,3,594,"IllegalStateException: Expected configuration ':module:debugFeatureCompileClasspath' to contain exactly one file, however, it contains 2 files",<android><kotlin><android-instant-apps><android-wear-2.0>,1,REFERENCE
Android,50423546,1,168,"How to offer actions of my app to other apps, via Smart-Linkify (AKA ""smart text selection"")?",<android><android-8.0-oreo><smart-linkify><smart-text-selection>,1,REFERENCE
Android,50869969,3,172,"Android Architecture Blueprints ""todo‑mvp‑dagger"", where is @Provides for TasksIMPORT?",<java><android><kotlin><dagger-2><dagger.android>,1,REFERENCE
Android,50709880,1,286,"ERROR: In <declare-styleable> NavArgument, unable to find attribute type",<java><android><android-gradle>,1,REFERENCE
Android,51216376,1,489,Room Retrofit Dagger2 MVP: Error: cannot find symbol variable DaggerAppComponent,<android><dependency-injection><retrofit><dagger-2><android-room>,1,MODIFY
Android,29472129,3,1621,IntentService doesn't get called in combination with PendingIntent,<android><android-pendingintent><android-geofence><android-intentservice>,1,MODIFY
Android,51523053,2,71,How to know which finger is scanned for bio-metric?,<android><biometrics><android-fingerprint-api>,1,REFERENCE
Android,51757164,3,2313,How to create LiveData which emits a single event and notifies only last subscribed observer?,<android><android-architecture-components><android-jetpack><android-livedata>,1,MODIFY
Android,51781176,5,1740,Is SingleLiveEvent actually part of the Android Architecture Components Library?,<android><android-architecture-components><android-livedata><mutablelivedata>,2,REFERENCE
Android,51884303,1,123,Adapter referencing generated classes (android-sunflower),<android><kotlin><android-jetpack>,1,REFERENCE
Android,51892478,6,3680,Multiple LiveData Observers After Popping Fragment,<android><android-fragments><kotlin><android-navigation><android-livedata>,2,REFERENCE
Android,51988532,6,308,Getting a Singleton in Kotlin,<kotlin>,2,MODIFY
Android,51309576,1,234,Why is IdlingResource null in Espresso tests on Android API 22?,<java><android><junit><android-espresso>,2,MODIFY
Android,52140059,6,994,Android Jetpack Navigation proper back stack with BottomNavigationView,<android><android-architecture-components><bottomnavigationview><android-navigation><android-jetpack>,2,REFERENCE
Android,52173040,1,653,Android Architecture sample unit testing live data,<android><kotlin><android-testing><android-architecture-components><android-livedata>,1,REFERENCE
Android,52235986,3,663,Room Database migration,<android><database><sqlite><android-room>,2,REFERENCE
Android,52381029,5,733,Can we extract public/private keys from the Android Keystore?,<android><android-keystore>,1,REFERENCE
Android,52367169,4,358,Crop Detected Face in Android,<android><crop><face-detection>,2,REFERENCE
Android,52441736,4,469,Android. Could not instantiate Worker,<android><dagger-2><android-room><android-architecture-components><android-workmanager>,2,MODIFY
Android,50615225,5,1315,Best way to update a single element using Paging Library,<android><android-architecture-components><android-paging><android-livedata>,1,REFERENCE
Android,52576072,1,416,Manifest marge error after migrating to androidX,<android><android-jetpack><android-navigation-component>,1,REFERENCE
Android,49832787,1,1264,Android LiveData prevent receive the last value when subscribe,<android><android-architecture-components><android-livedata><mutablelivedata>,5,REFERENCE
Android,52788958,1,157,Does event wrapper pattern replace the use of SingleLiveEvent?,<android><android-livedata><android-architecture-lifecycle><android-architecture>,1,REFERENCE
Android,52873173,20,3401,Migrating Junit4 tests to androidx: What causes 'delegate runner could not be loaded'?,<android><android-studio><junit><junit4><androidx>,5,MODIFY
Android,52873328,1,195,Android instant app permission request dialog not shown,<android><android-permissions><android-instant-apps>,2,MODIFY
Android,44497929,2,3333,Digital Assets Link link to my website,<android><google-console-developer><android-instant-apps>,7,MODIFY
Android,52972693,1,117,AndroidAnnotations + Instant App - The generated <applicationId>.R class cannot be found,<android><android-annotations><android-instant-apps>,2,MODIFY
Android,53051745,2,259,Android NDK - IMPORT shared library from source code,<android><c++><cmake><android-ndk><.so>,1,MODIFY
Android,53129932,4,618,How to capture frame by frame images from Android video recording in real time,<java><android><kotlin><video-processing><video-capture>,1,REFERENCE
Android,53193247,2,1575,Android Instrumentation Testing: No instrumentation registered Error,<java><android><android-studio><android-espresso>,1,MODIFY
Android,53372539,5,1017,Navigation graph with multiple top level destinations,<android><android-navigation-drawer><android-navigation><android-jetpack>,2,MODIFY
Android,53638074,1,25,Espresso finding row in RecyclerView that could be off screen,<android><android-recyclerview><android-espresso>,1,REFERENCE
Android,53573731,12,364,Not able to update sqlite_sequence table using RoomDatabase.query,<android><android-room>,3,REFERENCE
Android,53931191,1,51,How to ON or OFF audio recording using MediaRecorder,<java><android><audio><android-mediarecorder>,1,MODIFY
Android,54016644,9,704,What is the added advantage of using Bazel over Gradle?,<android><gradle><android-gradle><android-testing><bazel>,2,REFERENCE
Android,46646744,3,620,RecyclerView Items doesn't appear until i scroll it,<android><android-recyclerview><kotlin><mvp><android-constraintlayout>,2,MODIFY
Android,54448798,1,21,Where are the dependency Versions defined in IMPORT gradle (app) of Android Studio?,<android><android-studio>,1,IMPORT
Android,54489418,2,111,Kotlin Singletons: Object vs a Class with private constructor,<kotlin><singleton>,1,REFERENCE
Android,54508117,4,138,Which is better for Android MVVM package by feature or package by layer?,<android><mvvm><android-architecture-components>,1,REFERENCE
Android,54847411,1,55,Android NavigationUI Fragment in Fullscreen Mode,<android><android-fragments><android-fragmentactivity><android-jetpack>,1,MODIFY
Android,54878343,2,246,Programmatically change ConstraintSet attribute in motion scene of MotionLayout,<android><android-layout><android-constraintlayout><android-motionlayout>,1,MODIFY
Android,54728368,1,110,Foreground Service with a Silent Notification,<java><android><notifications><foreground-service>,2,MODIFY
Android,54967251,4,246,How can I integrate OpenCV 4.0 into a pure C++ Android NDK project?,<android><c++><opencv><android-ndk>,1,REFERENCE
Android,54529117,1,44,"I face android media player error (-38, 0) in Samsung and Google latest version mobile",<android><android-mediaplayer><samsung-mobile>,1,MODIFY
Android,55038077,1,141,How to capture image inside the overlay in Camera2 API Android?,<android><overlay><crop><android-camera2>,2,MODIFY
Android,55237055,2,65,Databinding fails with JAXB class not found exception during compilation (using kapt),<kotlin><dagger-2><android-databinding><androidx><kapt>,1,MODIFY
Android,26241916,3,484,Error in Travis trying to submit app to Google's Play Store,<google-api><android-gradle><google-api-java-client><travis-ci><google-play>,2,REFERENCE
Android,26689630,8,2392,How to find an app's available restrictions for DevicePolicyManager.setApplicationRestrictions,<android><google-chrome><android-5.0-lollipop><device-policy-manager>,1,REFERENCE
Android,27311251,3,681,How to obtain package info list form primary account when application in managed profile?,<android><android-5.0-lollipop><device-policy-manager>,3,MODIFY
Android,27529852,3,5007,new android Camera2 Api on nexus 7,<android><android-camera>,4,MODIFY
Android,27738431,1,278,Android L - EMM/MDM - Launching Managed app from Unmanaged app,<android><android-5.0-lollipop>,1,REFERENCE
Android,27876937,2,508,WatchFace sample - how to run,<android><nullpointerexception><sample>,1,RUNNING
Android,28257607,1,645,SlidingTabStrip indicator underneath SlidingTabLayout,<android><android-tabs><android-sliding>,1,MODIFY
Android,29029594,22,7668,Testing geofencing with Google Play Services 6.5.+,<android><google-play-services><geofencing>,6,REFERENCE
Android,29071154,1,300,Why Reveal effect not working as per Developer blog,<android><android-layout><material-design><viewanimator><circularreveal>,1,MODIFY
Android,29253846,3,1001,Replacing Fragment does not work properly while swipeRefresh is running,<android><android-recyclerview><swiperefreshlayout>,2,RUNNING
Android,29431021,5,3713,Capturing 4:3 camera picture via android Camera2 API on camera with 16:9 sensor array,<android><android-camera>,2,MODIFY
Android,29501618,6,6075,How to use Mediaprojection library in android to capture screen and convert into mp4 file?,<android><android-mediarecorder><android-mediaprojection>,3,MODIFY
Android,29540171,1,1148,How to customize the scrollbar on ListView?,<android><android-listview><scrollbar>,1,MODIFY
Android,29542859,3,2586,Autocomplete Google Places sample,<android><autocomplete><google-places-api>,1,RUNNING
Android,29556406,1,199,Camera2 is scaled on Front Camera of Nexus 7 2013,<android><camera>,1,MODIFY
Android,29578606,2,1479,Android Genymotion Location (Google Services API) doesn't work,<android><location><genymotion><genymotion-gps>,3,RUNNING
Android,29822760,8,9353,"Device owner on a nonrooted device (Android L), without NFC, using adb shell, dpm set-device-owner",<android><android-5.0-lollipop><kiosk-mode>,2,MODIFY
Android,30172529,10,753,"When Is a TextureView's ""Consumer Side"" Closed?",<android><android-camera><textureview>,2,MODIFY
Android,30334319,16,9602,Android camera2 face recognition,<android><android-camera><face-detection><face-recognition>,4,MODIFY
Android,30350739,9,24330,AutoCompleteTextView with Google Places shown in ListView just like Uber,<android><android-fragments><android-listview><google-places-api><autocompletetextview>,3,REFERENCE
Android,30622664,1,1015,Front Camera preview is not full screen,<android><camera>,2,MODIFY
Android,31154802,2,1918,Geofencing with only GPS does not work in android,<android><gps><geolocation><geofencing><android-geofence>,3,MODIFY
Android,31229953,3,2394,get data of each android.hardware.camera2 frame before it is displayed on the surfacetexture,<android><image-processing><android-camera><android-5.0-lollipop>,2,MODIFY
Android,31232008,5,4521,android camera2 process each frame and display its preview,<android><image-processing><android-camera><surfaceview>,1,MODIFY
Android,31450919,1,3044,BluetoothLE BluetoothAdapter﹕ startLeScan(): null,<android><bluetooth><bluetooth-lowenergy>,1,MODIFY
Android,31640783,2,2254,GeoDataApi.getAutocompletePredictions not working,<google-maps><google-maps-android-api-2><google-places-api>,1,MODIFY
Android,31734248,1,230,Android Universal Music Player ic_by_genre is not displayed,<java><android><android-layout><android-resources>,1,MODIFY
Android,32063524,7,4011,How to get each frame data using camera2 API in Android5.0 in realtime,<android><android-camera>,2,MODIFY
Android,32105132,1,1246,Android Google Play Service Barcode scanner does not works on 1D (EAN13) barcodes,<android><google-play-services><google-vision>,1,MODIFY
Android,32105785,6,8484,Trying to import code from GitHub into Android Studio,<android><android-studio><google-vision><android-vision>,2,IMPORT
Android,32134299,39,16587,Can you request permissions synchronously in Android Marshmallow (API 23)'s runtime permissions model?,<android><android-permissions><android-6.0-marshmallow>,5,REFERENCE
Android,32193244,3,1679,Can't debug NDK samples with Android Studio 1.3.2 on Windows,<android><c++><debugging><android-studio><android-ndk>,1,MODIFY
Android,32362072,3,707,Why is Google Geofencing API on Android not working on all devices,<android><google-api><location><google-play-services><android-geofence>,1,RUNNING
Android,32525489,1,986,View doesn't fill the whole screen,<android>,3,MODIFY
Android,32715573,30,2306,Media Recorder with Google Vision API,<android><android-camera><android-mediarecorder><google-vision><android-vision>,1,MODIFY
Android,32736708,2,4172,How to use Bluetooth Low Energy (BLE) in an android chat application?,<android><bluetooth><chat><bluetooth-lowenergy>,2,REFERENCE
Android,32961771,9,1918,Camera2 API onCaptureComplete() is called but camera state is still CONTROL_AE_STATE_PRECAPTURE,<android><android-camera><camera2>,2,MODIFY
Android,32970996,1,936,"how to become the preview stream in RAW Format (Camera2 API , ImageFormate.RAW_SENSOR)?",<android><preview><camera2>,1,MODIFY
Android,32988308,2,745,Cannot understand the details of FaceDetector object while debugging using Vision API Android,<android><google-api><google-play-services><face-detection><android-vision>,1,MODIFY
Android,33115337,8,11927,PLACES_API_INVALID_APP error from Android Play Places,<android><google-places-api>,8,RUNNING
Android,33127258,10,4255,Front Camera in Camera2 not capturing image,<android>,5,RUNNING
Android,33151244,11,8478,Implement Tap to Focus in Camera2 API,<android>,3,MODIFY
Android,33686656,1,682,How to get the universal music player to detect on device music?,<android>,1,MODIFY
Android,33876196,4,2155,"Android Camera 2, how to crop preview size",<android><preview><android-camera2>,3,MODIFY
Android,34070557,1,997,Android camera2 Lens intrinsic calibration,<java><android><android-camera><android-hardware><android-camera2>,1,MODIFY
Android,34609427,18,4795,Stop listening for fingerprint when screen off,<android><fingerprint>,3,REFERENCE
Android,34881551,3,1754,"ConnectionResult{statusCode=INTERNAL_ERROR, resolution=null, message=null}",<android><google-api-client><android-tv><google-nearby>,1,RUNNING
Android,35054405,3,2320,Detect Gestures on Fingerprint Sensor-Android,<android><gesture><android-6.0-marshmallow><fingerprint>,2,REFERENCE
Android,35056994,1,1265,Get detected face bitmap,<android><android-camera>,2,MODIFY
Android,35127970,1,408,Protect value with fingerprint,<android><security><fingerprint><biometrics>,1,MODIFY
Android,35244472,1,289,How configure GCM for an Android Device Policy Controller (DPC),<android><google-cloud-messaging><android-5.1.1-lollipop><android-managed-profile>,1,MODIFY
Android,35381104,46,943,In-app purchase promo codes breaks remote server verification?,<android><google-play><in-app-billing><promotion-code>,1,REFERENCE
Android,35629725,3,299,How to upload obb file to Google Play via Android Publisher Java API v2,<java><upload><google-play-developer-api>,2,MODIFY
Android,35660883,1,716,Universal Android Media Player - UAMP,<android><media-player><playback>,1,MODIFY
Android,35699359,2,337,NearbyBackgroundBeacons demo returns unknown status code 2801 on subscribe,<android><google-api><google-play-services><bluetooth-lowenergy><google-nearby>,1,MODIFY
Android,35811411,7,4829,Accessing AutoFocus/Flash with Google Vision BarCode Reader,<android><android-camera><barcode-scanner><camera-flash>,2,MODIFY
Android,35877936,6,1661,Who has a material how to work with the Face Detection Camera 2 API?,<java><android><camera><android-camera>,2,MODIFY
Android,36051791,1,1129,Face detection with android.hardware.Camera2,<android><android-5.1.1-lollipop><android-camera2>,1,MODIFY
Android,36170914,1,370,Memory Leak issue : com.example.android.uamp.ui.FullScreenPlayerActivity has leaked,<android><memory-leaks><exoplayer>,1,RUNNING
Android,36174807,8,4355,How to programmatically take Photos while recording Video using Camera2 API in Android,<android><image><video><android-camera2>,6,MODIFY
Android,36265659,3,3663,How Capture Picture while mobile vision api - face tracking,<android><google-vision>,2,MODIFY
Android,36440019,1,199,I can't detect face with camera2,<java><android><camera2>,1,MODIFY
Android,36481333,4,827,Google nearby API background scan doesn´t work after application kill,<android><google-play-services><beacon><google-nearby>,2,MODIFY
Android,36530511,1,679,How to implement Google Fit step counter within a Fragment,<android><google-fit>,1,MODIFY
Android,36580297,2,2360,Error While using FIngerprintManager android API,<java><android><classnotfoundexception><android-fingerprint-api>,2,RUNNING
Android,36669064,1,3823,Create on click focus on CameraSource - Android QR Code detection,<android><camera><android-camera><qr-code><android-vision>,3,MODIFY
Android,36713033,2,494,Does Android Content Provider authority definition break the DRY rule?,<android><android-contentprovider><dry>,1,REFERENCE
Android,36715739,2,1541,camerasource takepicture is not working,<java><android><android-camera>,1,MODIFY
Android,36739298,2,592,Android camera2 delay between the video to the sound,<android><android-mediarecorder><camera2>,1,MODIFY
Android,36755427,3,454,Unable to integrate ffmpeg as a native dependency for an Android NDK project,<android><android-studio><ffmpeg><android-ndk><gradle-experimental>,1,MODIFY
Android,36964572,2,616,HandlerThread blocks UI android,<android><multithreading><android-camera2><android-looper><android-handlerthread>,2,MODIFY
Android,37014990,4,1045,Synchronized method called by Android Activity onCreate method,<java><android><multithreading><android-activity>,1,REFERENCE
Android,37075088,1,122,Camera2Basic : Application:transformClassesWithDexForDebug,<java><android><android-camera2>,1,IMPORT
Android,37327891,2,4322,Android vision - Face detector dependencies are not yet available,<android><google-play-services><google-vision>,2,RUNNING
Android,37371844,5,950,Can not use Google Barcode scanner,<android><android-vision>,3,RUNNING
Android,37539614,1,1399,Camera2Video Api full screen preview and video quality,<android><camera><android-camera><android-camera2>,3,MODIFY
Android,37547385,1,376,GeoFencing Best Stratigies,<android><android-geofence><google-geolocation><android-fusedlocation>,1,MODIFY
Android,37559401,11,1558,Switching to Camera2 in Android Vision API,<android><android-vision>,2,REFERENCE
Android,37597252,3,437,How should we deal with the growing IMPORT in a mvp project's model layer?,<android><IMPORT-pattern><mvp>,1,REFERENCE
Android,37623264,7,1900,How to get the current frame (as a Bitmap) for android facedetector in a Tracker event?,<android><vision>,1,MODIFY
Android,37642551,3,1850,Android Camera2 API JPEG_QUALITY not available,<android><android-camera2>,1,MODIFY
Android,37764937,4,2792,FingerPrint API isHardwareDetected always returns false,<android-studio><android-6.0-marshmallow><android-fingerprint-api>,2,RUNNING
Android,37908660,2,1691,How to use flashlight/torch with Google Vision barcode reader API?,<android><google-play-services><barcode-scanner><flashlight><google-vision>,1,MODIFY
Android,37936693,2,1476,How do I get android location once at the push of a button?,<java><android><android-location>,2,MODIFY
Android,38296278,4,2637,Mockito: How do I use getString with mockito?,<android><unit-testing><mockito><android-context>,3,MODIFY
Android,38305431,1,1654,Google Place API get latitude & longitude of places,<android><autocomplete><google-places-api>,1,REFERENCE
Android,38493000,21,1895,"Camera2basic app, has very dark preview in Android 6.0 LGG3",<android><android-6.0-marshmallow><android-camera2>,3,RUNNING
Android,38535355,10,3877,android textureview full screen preview with correct aspect ratio,<java><android><android-camera><android-camera2><android-textureview>,3,MODIFY
Android,38809845,1,1010,Android Bluetooth app can't discover other devices,<android><bluetooth>,1,RUNNING
Android,38814600,1,286,Geofencing API: adding successful but not triggered,<android><android-studio><android-geofence>,1,RUNNING
Android,38869938,1,197,Android Send Data via Blue Tooth Low Energy adapter,<android><bluetooth><bluetooth-lowenergy>,1,MODIFY
Android,38901921,10,307,Intent not received from Android Geofence event,<java><android><android-intent><geofencing><android-geofence>,1,MODIFY
Android,39019899,3,1328,Android Face Detection API - Stored video file,<android><video><face-detection><android-vision>,2,REFERENCE
Android,39075163,2,770,Set OCR whitelist in the TextRecognizer,<android-vision>,1,MODIFY
Android,39131973,1,104,MediaRouterProvider not visible in the network,<android><casting><upnp><mediarouter>,1,MODIFY
Android,39253010,1,299,Android Camera2 - Remove black space between camera and bottom bar,<android><android-camera2>,1,MODIFY
Android,39363500,1,2781,setAlarmClock not exact in android marshmallow,<android><alarmmanager><android-alarms>,1,MODIFY
Android,39443657,2,967,camerasource.takePicture() save rotated images in some device,<android><google-vision>,3,REFERENCE
Android,39470098,14,4423,Why crypto object is needed for Android fingerprint authentication?,<android><android-fingerprint-api>,3,REFERENCE
Android,39481821,1,579,Use Camera2 to Preview and Process camera data,<android><android-camera2>,1,MODIFY
Android,39585232,2,158,Android in app purchase where to register receiver,<java><android><in-app-purchase><in-app-billing>,1,MODIFY
Android,39658993,16,3787,Where to put BroadcastReceiver in Android MVP?,<android><mvp>,5,REFERENCE
Android,39797164,1,1363,Is the Open Sourced Google Vision API CameraSource class Out-Dated?,<android><android-camera><google-play-services><android-vision><google-vision>,1,REFERENCE
Android,39982859,1,1584,Linking static libraries libm.a or libc.a with NDK cmake,<android><c++><android-ndk><cmake><clang>,1,MODIFY
Android,40144970,9,3229,Android MVP with Dagger 2 - Activity with multiple fragments,<android><mvp><dagger-2>,1,MODIFY
Android,40331561,1,1890,"Android, How to rotate recorded video using MediaRecorder in portrait mode",<android><video><orientation><mediarecorder><portrait>,2,REFERENCE
