Framework,Id,Score,ViewCount,Title,Tags,AnswerCount,Category
Android,40533276,2,1167,Android: Camera2 switching between back and front camera,<android><android-camera><android-camera2>,1,MODIFY
Android,40548551,6,1120,"How to generate KeyPair in android KeyStore, protected by custom password",<android><keystore><key-pair><android-fingerprint-api>,1,REFERENCE
Android,41221284,3,3425,How to change aspect ratio of camera2 preview?,<android><android-camera2>,1,MODIFY
Android,41284827,4,702,Application not listed in Android Auto,<android><android-auto>,2,RUNNING
Android,41296030,2,2496,"Swipe refresh to be called only when user swipes for it, not when user reaches top of list",<android><android-support-library><swiperefreshlayout>,4,MODIFY
Android,41518374,1,458,How can i get the image as in the preview size of TextureView in camera 2,<android><android-camera2>,1,MODIFY
Android,41623247,2,3377,Android Espresso test: Class not found: ...Empty test suite,<android><android-studio><gradle><android-gradle><android-espresso>,1,MODIFY
Android,41680922,1,115,Camera2 in FragmentPagerAdapter,<android><android-fragments><camera><android-viewpager>,1,MODIFY
Android,41713056,1,375,Take photo with bitmap in android camera,<android><bitmap><android-bitmap><google-vision>,1,MODIFY
Android,41766196,3,665,Face Tracker CameraSource Android: How to brighten front camera quality?,<android><android-studio><camera><google-vision><front-camera>,1,MODIFY
Android,41773621,3,3176,camera2 output to Bitmap,<java><android><bitmap><google-vision>,1,MODIFY
Android,41828237,5,929,Android In-app purchase NullPointerException,<java><android><nullpointerexception><in-app-purchase>,2,MODIFY
Android,41834529,4,605,getBuyIntentExtraParams does not exist? aka how do I use Version 6 in-app billing APIs?,<android><in-app-billing>,1,REFERENCE
Android,41926591,6,2179,How to reuse the Surface of MediaRecorder in the camera2 API on Android?,<android><video><mediarecorder><android-camera2>,1,MODIFY
Android,41985926,3,1480,Camera2 full screen preview and image capture,<android><camera>,2,MODIFY
Android,42107466,2,2351,Android Mobile Vision API detect mouth is open,<android><face-recognition><android-vision>,5,MODIFY
Android,42216472,2,167,Android Code Does not scan BLE device CC2650,<java><android><bluetooth-lowenergy><gatt>,2,RUNNING
Android,42268602,1,79,How to update closed/killed app from IntentReceiver?,<android><broadcastreceiver><updates><android-geofence>,1,MODIFY
Android,42345734,1,1715,Fingerprint scanner not detected when using Android 6.0 Fingerprint API on Samsung S5,<android><android-studio><android-6.0-marshmallow><fingerprint><android-fingerprint-api>,1,REFERENCE
Android,42418470,3,736,How to turn on the torch/flashlight with GooglePlay Services Vision API Xamarin Android,<android><xamarin><torch><flashlight><vision>,2,REFERENCE
Android,42548247,1,514,How can I create multiple fingerprint scan and register in db?,<android><fingerprint><android-fingerprint-api>,1,REFERENCE
Android,42581120,2,2482,How to create and run an example Vulkan app on the Android emulator?,<android><android-emulator><vulkan>,2,RUNNING
Android,42623014,1,737,Android Studio 2.3: can't use string resource in android:versionName,<android>,2,RUNNING
Android,43159280,10,2007,How to use mobile vision API with TextureView and Camera,<android><android-vision><google-vision><android-textureview>,1,REFERENCE
Android,43251528,29,31846,Android O - Old start foreground service still working?,<android><location><android-8.0-oreo>,7,REFERENCE
Android,43300273,2,205,Nearby Connections NullPointerException,<android><google-nearby>,1,REFERENCE
Android,43319318,1,1063,Android Camera2 API preview sometimes distorted,<android><preview><android-camera2><distortion><camera2>,2,MODIFY
Android,43382586,1,261,How to use Firebase with the Android universal music player?,<android><firebase><android-asynctask><callback><firebase-realtime-database>,1,MODIFY
Android,43440909,1,476,Get byte array with Android Vision scanning pdf417 barcode,<android><android-vision>,1,MODIFY
Android,43460985,2,4098,Android Camera2 preview occasionally rotated by 90 degrees,<android><rotation><android-camera2>,3,REFERENCE
Android,43515031,1,152,Why does SyncAdapter create a default periodic sync even though I have not called addPeriodicSync()?,<java><android><android-syncadapter>,2,MODIFY
Android,43532713,2,133,Google's VisionAPI example FaceTracker Camera permission,<android><android-camera><google-vision>,1,RUNNING
Android,43549220,1,375,Android media recorder crashes on stop,<android><google-api><android-mediarecorder><android-camera2>,1,RUNNING
Android,43632379,1,467,Android vision api OCR example is not detecting all text,<android><android-vision>,1,MODIFY
Android,43821919,1,1361,Are Google Play Services Supported on Android Things?,<android><google-play><google-nearby><android-things>,3,RUNNING
Android,44022751,2,356,"onLocationChanged never called , GoogleApiClient",<android><google-maps><geolocation><google-api-client>,2,MODIFY
Android,44181562,1,667,[Android]Registering fingerprints in application,<android><android-fingerprint-api>,1,MODIFY
Android,44231334,16,4290,Android architecture components with MVP,<android><android-architecture-components>,2,REFERENCE
Android,44249483,2,622,Orientation corners of a QR-code,<android><image-processing><mobile><android-vision>,1,REFERENCE
Android,44467885,4,234,Android Wear - Launching Google Play on Phone,<android><wear-os>,1,RUNNING
Android,44527420,6,1055,Android Camera2 focus state stuck,<android><android-camera2>,2,RUNNING
Android,44905858,1,474,Camera2 API doesn't work on emualtor,<android><android-emulator><android-camera>,1,RUNNING
Android,44911596,3,308,How do we implement in-app purchasing when the documentation is so inconsistent?,<android><in-app-purchase><google-play-services><in-app-billing><android-billing>,1,REFERENCE
Android,45005130,4,2200,SMS Retriever API - Generate 11 char hash code for app specific keystore file,<java><android><google-play-services>,1,REFERENCE
Android,45104944,1,885,Android Espresso Test Suites,<android><unit-testing><android-emulator><android-espresso><android-junit>,2,RUNNING
Android,45461226,12,9692,Android - Switch between front and back camera while recording a video,<android><android-layout><video><android-camera><android-camera2>,2,MODIFY
Android,45593065,4,1374,How to configure OpenSL to record voice call,<android><audio><android-ndk><opensl>,1,MODIFY
Android,45630903,3,545,Device Owner on rooted Galaxy S8,<android><device-admin><samsung-knox>,2,REFERENCE
Android,45692889,3,633,Android Camera 2 API problems with flash on Nougat 7.1,<android><flash><android-camera><android-7.0-nougat><android-camera2>,1,MODIFY
Android,46119375,5,1251,Architecture Components ViewModels inject with dagger with params that come from the Activity/Fragment,<android><mvvm><dagger-2><dagger><android-architecture-components>,1,MODIFY
Android,46134466,1,105,Android In-app purchase NullPointerException Purchase.getSku(),<java><android><in-app-purchase><in-app-billing>,1,MODIFY
Android,46268768,11,3161,ViewModel for Fragment instead accessing Activity ViewModel?,<android><android-fragments><mvvm><kotlin><android-architecture-components>,2,REFERENCE
Android,46273499,1,585,Trouble Connecting Android App to Raspberry Pi 3 over BLE,<android><bluetooth><bluetooth-lowenergy><raspberry-pi3><android-ble>,1,RUNNING
Android,46275819,2,283,Add OpenSL to android,<java><android><android-ndk><opensl>,1,REFERENCE
Android,46294833,7,6415,Correct way to create Notification Channels from Android O Api,<android><android-notifications><android-8.0-oreo><notification-channel>,3,REFERENCE
Android,46317509,1,1033,Use emoji in strings.xml with EmojiCompat support library,<android><emoji>,3,REFERENCE
Android,46465056,6,8033,AppCompatActivity not implementing LifecycleOwner,<java><android><android-architecture-components><android-architecture-lifecycle>,2,MODIFY
Android,46533989,4,497,Inject ViewModelFactory.Provider in activity for espresso testing,<android><dagger-2>,1,MODIFY
Android,46543877,1,67,How to play multiple songs together in sync?,<android><audio><android-ndk><audio-player><opensl><android-music-player>,1,MODIFY
Android,46567945,4,572,Refreshing MediaBrowserService subcription content,<android><kotlin><android-mediasession><mediabrowserservice><mediabrowserservicecompat>,1,REFERENCE
Android,46601474,2,429,How to bind into map with multi ViewModelFactory using Dagger2,<java><android><dagger-2><dagger.android><android-architecture-components>,1,MODIFY
Android,46666474,7,1804,FirebaseApp initialization unsuccessful in Android Instant apps,<android><firebase><android-instant-apps><google-play-services>,1,REFERENCE
Android,46696170,3,2594,Best practices and patterns in ViewModel + Data Binding. Is ObservableField in ViewModel OK?,<android><design-patterns><android-databinding><android-architecture-components><android-mvvm>,1,REFERENCE
Android,46774604,1,108,DiskLRUCache for Bitmaps (and others) in Android,<android><bitmap><android-lru-cache><imageresizer-diskcache><diskcache>,1,REFERENCE
Android,46831355,1,452,Gradle: DSL method not found: minSdkVersion / targetSdkVersion / compileSdkVersion / IMPORTToolsVersion,<android><gradle><dsl><android-gradle-2.2>,1,IMPORT
Android,47158230,1,298,Prevent app crash due to Google native library error,<android><google-vision><crash>,2,REFERENCE
Android,47236796,9,1107,"What is ""deps"" in ""implementation deps.support.app_compat""?",<android><gradle><IMPORT.gradle>,2,REFERENCE
Android,47248029,1,499,Memory leak with Android camera2 API,<java><android><memory-leaks>,1,MODIFY
Android,47459523,24,2967,Android MVVM: Activity with multiple Fragments - Where to put shared LiveData?,<android><mvvm><android-viewmodel>,1,REFERENCE
Android,47469398,3,2820,LiveData - Using SingleLiveEvent with Transformations,<android><mvvm><android-architecture-components><android-livedata>,1,REFERENCE
Android,47479274,1,94,Android - get ActivityRecognition service values back to MainActivity,<java><android><intentservice><activity-recognition>,1,REFERENCE
Android,47528461,1,143,Google play service sample not getting location offline,<android><gps><location><google-play-services><android-fusedlocation>,2,MODIFY
Android,47529737,2,3017,Avoid 'Variant Selection Conflicts' warning when using android test plugin without release variant,<android><android-studio><android-testing><android-gradle-3.0><gradle-android-test-plugi>,1,MODIFY
Android,47533726,6,422,How to use MediaCodec with Camera2?,<android>,1,MODIFY
Android,47544132,1,345,addAccountExplicitly throws SecurityException because com.google.android.gm is not allowed to perform GET_ACCOUNTS,<android><android-syncadapter><android-securityexception>,1,RUNNING
Android,47551921,1,556,React Native android camera2 aspect ratio issue,<android><react-native><android-camera2>,1,REFERENCE
Android,47621046,1,151,Closing the Android CameraDevice is slow and hangs the application,<android><android-camera2>,1,MODIFY
Android,47839974,1,479,Save real-time detected face(Track Faces) image using 'android-vision' library,<java><android><android-vision>,1,MODIFY
Android,47860064,2,122,Is it a good practice to use a single fragment to display the UI instead of the activity?,<android><android-fragments><design-patterns><android-activity><architecture>,2,REFERENCE
Android,47874391,2,596,Dagger 2 inject ViewModel odd behavior (ViewModel not re-used on screen rotation),<android><mvvm><android-lifecycle><dagger-2>,1,MODIFY
Android,47880718,1,42,how transferring data to connected bluetooth LE device,<java><android><bluetooth><hex><bluetooth-lowenergy>,1,MODIFY
Android,48005850,8,293,android-RuntimePermissions sample code not working,<java><android><android-studio><intellij-idea>,5,IMPORT
Android,48020271,1,42,BLE development on VIVO smartphones?,<android><bluetooth-lowenergy>,1,RUNNING
Android,48095462,1,161,How to pass the actual barcode scanned to an ImageView,<android><barcode><google-vision>,1,MODIFY
Android,48105925,1,596,"Should my mvvm, livedata app cancel network requests when app is backgrounded?",<android><mvvm><android-architecture-components><android-architecture-lifecycle>,1,MODIFY
Android,48169430,11,428,Network Awareness from IMPORT using RxJava,<android><rx-java2><rx-android>,1,REFERENCE
Android,48189415,13,3814,Is it correct to bind a ViewModel to a Service?,<android><android-service><android-architecture-components><android-viewmodel>,1,REFERENCE
Android,48198374,1,301,Continuously take still photo with android Camera2,<android><android-camera><android-camera2>,1,MODIFY
Android,48241802,1,224,Dagger 2 - two instances of the same View model are created,<android><viewmodel><dagger-2><dagger.android>,1,MODIFY
Android,48382642,1,90,Prevent Android Wear Complication Tinting,<java><android><wear-os><android-wear-complication>,1,MODIFY
Android,48524083,1,452,Camera2 API Working Only for First 5 Pictures,<java><android><android-camera2>,1,MODIFY
Android,48604251,3,2084,Observing IMPORT LiveData from ViewModel and notify UI,<android><mvvm><kotlin><android-architecture-components>,1,MODIFY
Android,48608334,1,264,Google Vision API CameraSourcePreview FPS,<android><android-camera><frame-rate><face-recognition><google-vision>,1,MODIFY
Android,48675221,6,833,Location Updates with FusedLocationProviderClient produces memory leaks,<android><memory-leaks><google-api-client><fusedlocationproviderclient><location-updates>,1,MODIFY
Android,48887518,1,476,Espresso Test Fail due to App not Idle Exception: The following Idle Conditions failed ASYNC_TASKS_HAVE_IDLED,<android><unit-testing><android-espresso><android-instrumentation>,1,MODIFY
Android,48972343,1,1654,IMPORT to return LiveData when Room doesn't have it and instead fetches from REST API,<android><android-room><android-architecture-components><android-livedata><android-viewmodel>,2,REFERENCE
Android,49024906,1,36,Android device unable to connect with BleGattServer,<android><bluetooth-lowenergy><bluetooth-gatt>,1,RUNNING
Android,49167514,1,121,Store user credentials in Android keystore/keychain,<android><keystore><keychain><key-storage>,1,REFERENCE
Android,49236067,1,233,"Dagger 2, scopes + annotation",<dagger-2><dagger.android>,1,REFERENCE
Android,49520242,2,558,Multiple fragment in one Activity in Android MVP,<android><mvp><android-mvp><android-architecture>,2,REFERENCE
Android,49696008,1,729,How to switch android-ndk example to use gcc instead of clang?,<gcc><gradle><android-ndk><clang>,1,IMPORT
Android,49834875,4,2021,Problems with using tensorflow lite C++ API in Android Studio Project,<android><c++><tensorflow><android-ndk><android-studio-3.0>,1,REFERENCE
Android,49940190,4,784,Instant App not available for testing,<android><android-instant-apps>,1,MODIFY
Android,50031467,2,251,PackageInstaller error when pragmatically updating app,<android><android-7.0-nougat><device-owner><cosu><packageinstaller>,1,REFERENCE
Android,50121501,6,472,Handling input with Android Architecture Components,<android><mvvm><android-architecture-components>,2,REFERENCE
Android,50173009,5,1115,MVVM - handling Disposable-s in ViewModel with RxJava and Room,<android><mvvm><rx-java2><android-room><android-viewmodel>,1,REFERENCE
Android,50177783,10,928,NotificationManagerCompat vs NotificationManager,<android><push-notification><notifications><android-notifications>,1,REFERENCE
Android,50456919,44,2004,Paging library - Boundary callback for network + db with API taking page and size,<android><android-room><android-architecture-components><android-livedata><android-paging>,2,REFERENCE
Android,50735291,2,538,Screen Sharing between Devices using Media Projection API,<android><mediacodec><mediamuxer><android-mediaprojection>,1,MODIFY
Android,50747713,1,231,How to pass by Retrofit Header and Field Maps with Paging Library,<android><paging><android-architecture-components><androidx>,2,REFERENCE
Android,50758822,3,3869,Failed to resolve: play-services-auth-base-license version 11.8.0,<android><android-gradle><resolve><play-services-auth-base-license>,4,IMPORT
Android,50770478,5,734,how to add player control ui in google IO18 audio App demo,<exoplayer><exoplayer2.x>,1,REFERENCE
Android,50782496,2,411,How to specify which thread(s) room live queries to run on?,<android><android-room><android-architecture-components>,1,MODIFY
Android,50797934,13,138,UAMP MediaBrowser orientation,<android><mediabrowserservicecompat>,1,MODIFY
Android,50970915,33,2247,How do some apps overcome phone recording restrictions?,<android><audio><call-recording>,1,REFERENCE
Android,51067310,3,175,Adding media item to MediaBrowserService,<java><android><media-player><audio-player><mediabrowserservice><android-music-player>,1,MODIFY
Android,51192192,3,145,How to record video that is already streamed on onPreviewFrame,<android><video-streaming><android-camera><opentok><android-video-record>,2,MODIFY
Android,51203665,3,188,Is it possible to use SingleLiveEvent with Room in Android?,<android><android-room><android-livedata>,1,MODIFY
Android,51252795,1,132,Can't get Google Fit OAuth 2.0 linked to WearOS App,<android><wear-os><google-fit>,1,MODIFY
Android,51365460,4,245,DataBoundListAdapter with multiple item types,<android><android-recyclerview><recycler-adapter><android-architecture-components>,2,MODIFY
Android,51387282,1,303,Android In App billing fails with repsonse code 6,<android><in-app-purchase><google-play-services><in-app-billing>,1,MODIFY
Android,51393867,1,639,What is the correct way to create a ViewModelFactory for an AndroidViewModel,<android><dependency-injection><kotlin><android-viewmodel>,1,MODIFY
Android,51496306,1,94,(Android IMPORT Pattern) Update phone database data with deleted items from web,<android><IMPORT-pattern><android-room><android-architecture-components>,1,REFERENCE
Android,51498296,1,83,"Android Auto Music app is not showing in ""Android auto"" app",<android><media-player><auto>,1,RUNNING
Android,51801851,3,419,Inject activity's ViewModel into fragment's ViewModel,<android><dagger-2><android-architecture-components><android-viewmodel><dagger-android>,1,MODIFY
Android,51854567,3,682,Why are the IMPORT classes singletons in this sample app?,<android><android-architecture-components><android-jetpack>,1,REFERENCE
Android,51879224,5,1008,The Navigation Architecture Component animation,<android><kotlin><navigation>,1,MODIFY
Android,51892029,1,122,Video inverts 180 after recording in front camera 2 api,<android><android-camera2>,1,MODIFY
Android,51988969,2,376,How to link correctly C++ files to an existing Android Project in Android Studio?,<android><c++>,2,MODIFY
Android,52269697,1,61,Can loadInitial() be blocking when loading data from API,<android><android-paging>,1,REFERENCE
Android,52374888,3,228,Camera2 1440x1080 is maximum,<android><android-camera2>,1,RUNNING
Android,52454186,3,157,IMPORT pattern with paging library,<android><android-paging-library>,1,MODIFY
Android,52477887,3,239,Big problem Android Studio 3.3 Canary 11 (gradle 3.3.0 alpha 11) with Kotlin 1.3.0-rc-57 and constraintlayout 2.0,<android><android-studio><android-gradle>,2,REFERENCE
Android,52480833,1,240,"Dynamic Feature activity not loading, stuck at installation",<android><generics><app-bundle><android-app-bundle>,2,REFERENCE
Android,53141233,1,76,Android ViewPager preloading too much fragments,<android><android-viewpager>,1,MODIFY
Android,53445426,1,100,How to record video using Camera2 API in SceneForm,<android><android-camera2><sceneform>,1,REFERENCE
Android,53494927,6,63,MediaBrowserCompat queue find item,<android><android-mediasession>,1,MODIFY
Android,53507668,1,80,"Where to place Toasts, Snackbars etc. in era of Android Architecture Components",<android><android-architecture-components><android-viewmodel>,2,REFERENCE
Android,53635269,2,380,Gradle cannot resolve androidx.appcompat:appcompat:1.1.0-alpha01 and com.google.android.gms:play-services-nearby:16.0.0,<android><android-studio><gradle><android-gradle><google-play-services>,2,IMPORT
Android,53865978,7,2071,Why SMS Retriever API don't work in release mode?,<android><android-intent><android-broadcast><android-broadcastreceiver><android-sms>,6,RUNNING
Android,54073476,1,45,Cannot create directory and save picture taken by camera in storage/emulated/0,<android><camera><storage><external>,1,MODIFY
Android,54091648,2,230,"Camera 2 API to Preview, Record and Extract the preview frame to Firebase face detection processing simultaneously",<android><face-detection><android-camera2>,2,MODIFY
Android,54319444,2,362,<android.arch.lifecycle.ViewModel>> cannot be provided without an @Provides-annotated method,<java><android><dependency-injection><viewmodel><dagger-2>,1,MODIFY
Android,54402542,2,96,Inject Adapter to Fragment using Dagger2,<android><kotlin><recycler-adapter><dagger-2>,1,MODIFY
Android,54493736,1,143,Creating an instance of Room Database inside the callback or use the member variable of that database,<java><android><callback><android-room>,1,REFERENCE
Android,54539912,3,64,Is Picture-in-Picture mode supports bellow Oreo,<android><youtube-api><picture-in-picture>,1,REFERENCE
Android,54608165,2,303,Barcode scanning is not working with vision API,<android><barcode-scanner><android-vision><firebase-mlkit>,1,RUNNING
Android,54640389,1,37,android ndk opengl creating protected context,<android><opengl-es><android-ndk><egl>,1,MODIFY
Android,54879581,1,91,Architecture Navigation Component : onCreateView gets called every time,<android><androidx><fragment-backstack><android-navigation-component>,1,REFERENCE
Android,55083734,1,47,"java.lang.UnsatisfiedLinkError: dlopen failed: library ""/Users/..."" not found",<android><android-ndk><java-native-interface><shared-libraries>,1,MODIFY
Android,55196032,1,61,Pre-Populate Room Database using WorkManager and Dagger,<android><android-room><dagger><android-workmanager>,1,MODIFY
Android,55301892,1,114,SMS Retriever API android system unable to send message to the Broadcast Receiver,<android><kotlin><sms>,1,REFERENCE
Android,55520315,3,72,Requesting high precision location with LocationSettingsRequest not updating location settings,<android><google-play-services><android-location>,1,REFERENCE
Android,55764251,1,25,Retrofit LiveDataCallAdapter doesn't call function adapt (call),<android><kotlin><retrofit><android-livedata>,1,MODIFY
Spring,18888714,1,1579,Spring MVC application RUNNINGed on Tomcat does not run on IntelliJ,<java><spring-mvc><intellij-idea><tomcat7>,1,RUNNING
Spring,19482372,1,4863,How do I simplify mockito/hamcrest argument matchers in test method?,<java><spring><unit-testing><mockito><hamcrest>,2,REFERENCE
Spring,20101448,1,2420,@Column or @Basic JPA annotations ignored in spring-data-jpa schema creation,<java><spring><jpa><spring-data><spring-data-jpa>,2,MODIFY
Spring,20168563,5,7231,Spring-boot UTF-8 resources,<java><spring><utf-8><spring-boot>,2,MODIFY
Spring,21305874,1,1083,Fail to connect to Rabbitmq using Spring 4.0 webstocket stomp api,<rabbitmq><spring-4><spring-messaging><spring-websocket>,1,MODIFY
Spring,22600920,1,303,Spring Neo4J REST error - nodeStateTransmitter,<java><spring><rest><neo4j><spring-boot>,1,IMPORT
Spring,22935840,2,4169,Cannot IMPORT Spring 4 project with Maven,<java><spring><maven><pom.xml>,3,IMPORT
Spring,23366226,28,23955,Spring Boot w/ JPA: move @Entity to different package,<spring><jpa><spring-data><spring-data-jpa><spring-boot>,4,MODIFY
Spring,24025004,5,3165,Spring Boot & Maven war overlay,<maven><spring-boot><maven-war-plugin>,1,MODIFY
Spring,24539899,1,5245,Gradle error: java.lang.String cannot be cast to org.gradle.api.artifacts.Configuration,<java><spring><gradle>,2,IMPORT
Spring,25571843,7,4574,Problems accessing fresh RUNNING of SpringBoot sample app on Weblogic12C,<java><spring><spring-boot><weblogic12c>,3,MODIFY
Spring,27105619,1,1121,spring boot mvc: failed after following the sample,<spring><spring-mvc>,1,RUNNING
Spring,27171629,1,1627,Get access token using spring social facebook api,<java><facebook><spring><spring-social><spring-social-facebook>,1,MODIFY
Spring,28702698,2,3201,springboot initialization error on startup with mongodb on gorm/groovy,<spring><mongodb><groovy><gorm><spring-boot>,1,IMPORT
Spring,29299181,2,2111,Why are my Spring Data repositories not found if moved into another package of a Spring Boot application?,<spring-boot><spring-data>,1,MODIFY
Spring,29831953,7,19117,maven IMPORT failing when generating war package for spring boot application?,<spring><maven><tomcat><spring-boot>,2,RUNNING
Spring,29831374,1,700,how to pass parameters from web requests to spring boot yarn application,<hadoop><spring-boot><yarn><spring-data-hadoop>,1,REFERENCE
Spring,31730050,5,1038,spring-boot-starter-ws performance when run as jar,<spring><maven><soap><spring-boot><spring-ws>,1,REFERENCE
Spring,34525587,7,4791,Invalid wsdl generated by spring-ws when the request element doesn't end with 'Request',<java><web-services><wsdl><cxf><spring-ws>,3,MODIFY
Spring,34512248,7,1291,"Spring Social: ""Unable to get a ConnectionRepository: no user signed in""",<spring><facebook><spring-security><spring-social><spring-social-facebook>,2,MODIFY
Spring,34606760,8,14125,@WebAppConfiguration and @ContextConfiguration for Spring Boot + Thymeleaf,<java><spring><spring-boot><integration-testing><thymeleaf>,2,MODIFY
Spring,35076591,2,3977,What does CommandLineRunner do in this case?,<java><spring><spring-boot>,1,REFERENCE
Spring,35584271,6,12422,"Spring Data MongoDB Annotation @CreatedDate isn't working, when ID is assigned manually",<java><spring><mongodb><spring-data><spring-data-mongodb>,1,MODIFY
Spring,35195982,1,1196,Spring-boot @Async not running with @Scheduled,<java><spring><spring-boot><spring-scheduled><spring-async>,1,MODIFY
Spring,35709341,2,1549,"How do you RUNNING the ""IMPORTing REST Services with Spring"" tutorial?",<java><spring><rest><maven><spring-boot>,2,RUNNING
Spring,36433556,1,43,Why my gradle project always downloading 200MB data from Internet?,<spring><gradle>,1,IMPORT
